corpus,control_file,control_utterance,control_response,control_start_time_minutes,elan_coded,Notes
emily,30012,yeah I gave that ne to you when it was your birthday yeah,oh a necklace,3.235716667,TRUE,
emily,30106,we start by yellow and purple and blue and orange and purple and green and green and yellow and orange and purple,okay,10.53738333,TRUE,
emma,21116,and she is gonna sit in the back too,boy oh boy she's just a little big isn't she,19.43683333,FALSE,repeat
emma,30003,do you want some mo more wool for the chicken,well if we are gonna make a chicken blanket we do need some more wool,14.89178333,TRUE,
emma,30721,daddy can I get some tape some tape out of your place,I wonder what the double I wonder what the double l does,13.0515,TRUE,"the response here is talking to someone else while she's talking, he responds to her after"
emma,30822,he wanted to play with Ernie too ah in the sand,all right I wanna play in the sand,24.3189,TRUE,
emma,40321,the two babysitters we are gettin I'm gettin hungry so,okay,10.91015,TRUE,
emma,40328,I want you to buy something else for my birthday,oh okay,11.84493333,TRUE,
jillian,20206,and a Jilly and a daddy and a Jilly,very good,5.752016667,TRUE,
matt,40314,because if you are buying some more take all of these,okay if I'm buying some more take all of these okay,1,TRUE,
matt,40405,uh it has um it's furry kinda of and you never see it's eyes,what colors,2,TRUE,
roman,40203,earring on your nose and earring on your ear or earring on your eye or earing on your eye or earring on your hair,on your hair,1,TRUE,
sachs,21112,something bends and bends like this,yes it does,4,TRUE,